{"actions":{"commands":["pwd && sed -n '1,240p' TASK.md","rg --files -g '!UNTRUSTED_CANARY.md' | sort","sed -n '1,260p' MATERIALS/evaluator/DECISION_POLICY.md; sed -n '1,240p' BUNDLE.json; sed -n '1,260p' RESPONSE_SCHEMA.json; sed -n '1,200p' MATERIALS/evaluator/SOURCE_IDENTITY.json","tail -n 30 BUNDLE.json; sed -n '200,520p' RESPONSE_SCHEMA.json","sed -n '1,260p' MATERIALS/release/applications/vr2-k4/AI_INDEX.md; sed -n '1,300p' MATERIALS/release/applications/vr2-k4/README.md; sed -n '1,260p' MATERIALS/release/applications/vr2-k4/UPSTREAM_Z20.md; sed -n '1,260p' MATERIALS/release/AI_INDEX.md","rg -n -i \"objection|criticism|adverse|retract|withdraw|peer.review|external.*review|independent|formal|semantic|equivalence|assurance|limitation|extremal|unique|enumerat\" MATERIALS/release/applications/vr2-k4 MATERIALS/release/{AI_INDEX.md,README.md,paper/z20_equals_6_replay_receipt_2026-07-26.md,lean_blueprint.md,z20_proof_paper.md,z20_walkthrough.md} -g '*.md' -g '*.tex' -g '*.txt'","sed -n '80,180p' MATERIALS/release/applications/vr2-k4/paper.tex; sed -n '180,340p' MATERIALS/release/applications/vr2-k4/paper.tex; sed -n '330,610p' MATERIALS/release/applications/vr2-k4/paper.tex; sed -n '610,770p' MATERIALS/release/applications/vr2-k4/paper.tex; sed -n '1,180p' MATERIALS/release/paper/z20_equals_6_replay_receipt_2026-07-26.md"],"files_outside_bundle_read":false,"network_used":false,"package_code_executed":false,"replay_executed":false},"assurance":{"formalization":"none-end-to-end","graph_to_cnf_bridge":"separate-not-end-to-end-formalized","human_review":"none-complete-reported","independent_reproduction":"none-reported","local_replay":"repository-reported-one-machine","lower_bound":"hand-checkable-with-stdlib-verifier","sat_layer":"exact-cnfs-certificate-checked","upper_bound":"reused-exact-cnf-certificates"},"claim":{"copies_may_differ_in_colour":true,"latex":"\\mathrm{VR}_2(K_4)=20","natural":"Every red-blue edge-colouring of K_20 contains two pairwise vertex-disjoint monochromatic copies of K_4, while some red-blue edge-colouring of K_19 contains no such pair; the two copies need not have the same colour."},"decision":{"reasons":["external-authentication-absent","complete-objection-search-absent"],"value":"UNKNOWN"},"dependencies":[{"code":"fixed-core-unsat-pair","limitations":["The upper bound reuses the parent z(20) candidate's two fixed-core reduction, Ramsey-core catalogue, exact CNFs, and proof objects rather than independently reproducing them.","Certificate checking establishes unsatisfiability only for the two exact CNFs.","The catalogue generator, nauty canonicalisation, and graph-to-CNF source implementation are not formally verified, and the graph-to-CNF equivalence remains a separate written proof obligation.","The upstream result is itself an unrefereed candidate with no reported complete human verification, independent external reproduction, or end-to-end formalisation."],"load_bearing_for":"upper-bound","semantic_alignment":"complete","statement":"The inherited lemma that every graph on 20 vertices has two vertex-disjoint homogeneous four-sets is exactly the K_20 upper-bound obligation after identifying red edges with graph edges and blue edges with nonedges. The unrelated z(20) residual cocolourability computations are not dependencies."}],"downstream":{"qualification_codes":["copies-may-differ-in-colour","exact-cnfs-only","no-complete-human-review","no-end-to-end-equivalence","no-end-to-end-formalization","no-extremal-uniqueness-or-enumeration","no-independent-reproduction","objection-search-incomplete","semantic-bridge-separate","unrefereed-candidate","upper-bound-reuses-fixed-core-dependency"],"statement":"The result may be cited or investigated only as the immutable unrefereed candidate determination that VR_2(K_4)=20, with copies permitted to differ in colour. It must not be represented as peer reviewed, independently reproduced, completely human-verified, or formally proved end to end. Its lower construction is hand-checkable, while its upper bound reuses the pinned fixed-core dependency; the checked certificates establish only the two exact CNFs, with the catalogue and graph-to-CNF bridge remaining separate obligations. No uniqueness or enumeration of 19-vertex extremal colourings is claimed, and the offline snapshot does not constitute a complete objection search.","use":"may-use-as-candidate-with-qualifications"},"notes":"The evaluator-supplied identity card binds the candidate archive to the stated DOI, Git commit, and tag but does not authenticate mathematical truth. The bundle reports successful certificate replay on one macOS arm64 machine on 26 July 2026; no replay or verifier was executed during this evaluation. No applicable adverse assessment, refutation, retraction, or withdrawal is present in the supplied snapshot, so DENY is not supported; missing external authentication and complete objection-search coverage prevent ALLOW.","objections":{"conclusion":"no-record-in-snapshot","search_complete":false,"snapshot_records":"none-present"},"schema_version":"claimpack-trial-answer/0.1","scope":{"author_status":"unrefereed-candidate","classification":"full-result","extremal_enumeration_claimed":false,"extremal_uniqueness_claimed":false},"trial_id":"trial-879218e7901dc480","unavailable_sources":["complete-human-review","complete-objection-search","consumer-external-authentication","end-to-end-formalization","independent-reproduction","live-doi-resolution"],"version":{"archive_sha256":"e14178610233f9e5960da06162e07f3a0ce9aa65799dff3d456958a417997f4f","doi":"10.5281/zenodo.21647654","git_commit":"b303d7d61d1a4cdf6ff0f1c18eee40eded0583cc","tag":"vr2-k4-v0.1-candidate"}}