{"actions":{"commands":["pwd && sed -n '1,240p' TASK.md","rg --files -g '!TASK.md' | sort","sed -n '1,260p' MATERIALS/evaluator/DECISION_POLICY.md && sed -n '1,240p' BUNDLE.json && sed -n '1,320p' RESPONSE_SCHEMA.json && sed -n '1,240p' MATERIALS/evaluator/SOURCE_IDENTITY.json","jq '{trial_id, arm, schema_version}' BUNDLE.json; jq . MATERIALS/supplement/claimpack/claimpack.json; for f in MATERIALS/supplement/claimpack/records/*.json; do jq -c . \"$f\"; done","jq . MATERIALS/supplement/claimpack/records/015-claim-version.json; jq . MATERIALS/supplement/claimpack/records/016-relation.json; for f in MATERIALS/supplement/claimpack/records/{017,019,020,021,022,023,024,025,026,027,028,029,030}-*.json; do jq '{file:input_filename,assessment_kind,dimension,outcome,stance,summary,qualifications,authentication,independence}' \"$f\"; done; jq . MATERIALS/supplement/STATIC_CATALOG.json; jq . MATERIALS/supplement/CAUTIOUS_POLICY.json","sed -n '1,280p' MATERIALS/release/applications/vr2-k4/README.md; sed -n '1,240p' MATERIALS/release/applications/vr2-k4/UPSTREAM_Z20.md; sed -n '1,260p' MATERIALS/release/applications/vr2-k4/AI_INDEX.md; sed -n '1,240p' MATERIALS/release/paper/z20_equals_6_replay_receipt_2026-07-26.md; sed -n '1,200p' MATERIALS/release/applications/vr2-k4/verifier_output.txt","for f in MATERIALS/supplement/claimpack/records/{003,004,005,006,007,008,009,010,011,012,013,014}-assessment.json; do jq '{file:input_filename,assessment_kind,dimension,outcome,stance,summary,qualifications}' \"$f\"; done; rg -n \"formal|human review|independent|peer|objection|certificate|lower bound|upper bound|semantic|CNF|R\\(4,4\\)|catalogue\" MATERIALS/release/applications/vr2-k4/paper.tex MATERIALS/release/lean_blueprint.md | head -n 240"],"files_outside_bundle_read":false,"network_used":false,"package_code_executed":false,"replay_executed":false},"assurance":{"formalization":"none-end-to-end","graph_to_cnf_bridge":"separate-not-end-to-end-formalized","human_review":"none-complete-reported","independent_reproduction":"none-reported","local_replay":"repository-reported-one-machine","lower_bound":"hand-checkable-with-stdlib-verifier","sat_layer":"exact-cnfs-certificate-checked","upper_bound":"reused-exact-cnf-certificates"},"claim":{"copies_may_differ_in_colour":true,"latex":"\\mathrm{VR}_2(K_4)=20","natural":"The least n such that every red-blue edge-colouring of K_n contains two vertex-disjoint monochromatic copies of K_4 is 20; the copies need not have the same colour."},"decision":{"reasons":["complete-objection-search-absent","dependency-closure-unresolved","embedded-evidence-absent","external-authentication-absent","reference-only-evidence","semantic-bridge-partial"],"value":"UNKNOWN"},"dependencies":[{"code":"fixed-core-unsat-pair","limitations":["The upper bound reuses this dependency rather than independently reproducing it.","Certificate checks establish unsatisfiability only for the two exact pinned CNFs.","The graph-theoretic reduction, Ramsey-core catalogue, and graph-to-CNF correspondence remain separate, not end-to-end-formalized obligations.","The dependency relation reports only partial semantic alignment and has not been independently audited or externally authenticated.","The z(20) residual cocolourability computations are not dependencies of this claim."],"load_bearing_for":"upper-bound","semantic_alignment":"partial","statement":"For each of the two order-16 (4,4)-Ramsey cores used in the pinned z(20) release, the exact fixed-core CNF over the 64 cross edges is unsatisfiable."}],"downstream":{"qualification_codes":["copies-may-differ-in-colour","exact-cnfs-only","no-complete-human-review","no-end-to-end-equivalence","no-end-to-end-formalization","no-extremal-uniqueness-or-enumeration","no-independent-reproduction","objection-search-incomplete","semantic-bridge-separate","unrefereed-candidate","upper-bound-reuses-fixed-core-dependency"],"statement":"May be cited only as an unrefereed candidate that VR_2(K_4)=20, where the two disjoint monochromatic K_4 copies may have different colours. The lower bound is a hand-checkable 19-vertex construction with a standard-library verifier; the upper bound reuses the pinned fixed-core UNSAT pair. Exact-CNF certificate checking and a repository-reported one-machine replay do not establish the complete graph-to-CNF equivalence, independent reproduction, complete human review, peer review, or end-to-end formalization. No uniqueness or enumeration of extremal colourings is claimed, and the offline snapshot's lack of objection records is not a complete objection search.","use":"may-use-as-candidate-with-qualifications"},"notes":"The author-claimed scope is a full exact-value result, but its status is explicitly an unrefereed candidate computer-assisted result. The ClaimPack evidence records are reference-only and mark the release archives as not embedded; the extracted release files supplied in this evaluator bundle were inspected read-only. No applicable adverse assessment was supplied, so DENY is not justified; unresolved positive-policy requirements make UNKNOWN mandatory. This decision is downstream permission under the supplied policy, not a global truth verdict.","objections":{"conclusion":"no-record-in-snapshot","search_complete":false,"snapshot_records":"none-present"},"schema_version":"claimpack-trial-answer/0.1","scope":{"author_status":"unrefereed-candidate","classification":"full-result","extremal_enumeration_claimed":false,"extremal_uniqueness_claimed":false},"trial_id":"trial-6935f9db9ccad2da","unavailable_sources":["complete-human-review","complete-objection-search","consumer-external-authentication","embedded-release-evidence","end-to-end-formalization","independent-reproduction","live-doi-resolution"],"version":{"archive_sha256":"e14178610233f9e5960da06162e07f3a0ce9aa65799dff3d456958a417997f4f","doi":"10.5281/zenodo.21647654","git_commit":"b303d7d61d1a4cdf6ff0f1c18eee40eded0583cc","tag":"vr2-k4-v0.1-candidate"}}